{
  "task_context": {
    "task_id": "FRONT-PJT-CASE-05-MTG-CASE-05-03",
    "project_id": "PJT-CASE-05",
    "manager_id": "MGR-CASE-05",
    "meeting_id": "MTG-CASE-05-03",
    "evaluation_period": "2026-01-01 ~ 2026-04-24",
    "status": "collected",
    "created_at": "2026-05-06T08:42:22.627Z",
    "updated_at": "2026-05-06T08:42:22.627Z"
  },
  "meeting_id": "MTG-CASE-05-03",
  "project_id": "PJT-CASE-05",
  "manager_id": "MGR-CASE-05",
  "manager_name": "周牧",
  "planner_slice": {
    "focus_dimensions": [
      {
        "dimension": "协同调度力",
        "priority": "medium",
        "reasons": [
          "日历、会议和通讯录样本齐备，可检查必要干系人同步与跨团队阻塞处理。"
        ]
      }
    ],
    "assigned_plan": {
      "agent_name": "Coordination Lens",
      "required": true,
      "input_keys": [
        "meeting_fact_pack",
        "hard_metrics_result",
        "raw_payload"
      ],
      "output_keys": [
        "dimension_findings",
        "human_review_items"
      ],
      "focus_dimensions": [
        "协同调度力"
      ]
    },
    "human_review_rules": []
  },
  "current_meeting": {
    "meeting_info": {
      "meeting_id": "MTG-CASE-05-03",
      "project_id": "PJT-CASE-05",
      "manager_id": "MGR-CASE-05",
      "manager_name": "周牧",
      "meeting_title": "供应链风险应急沟通",
      "meeting_time": "2026-04-24 09:00 - 09:45",
      "participants": [
        "周牧",
        "林峰"
      ],
      "calendar_event_id": "cal_case05_evt_0424_emergency",
      "review_status": "补录摘要"
    },
    "decisions": [
      "协调供应链总监争取插队",
      "同步评估供应商C打样能力",
      "周牧单独跟进不占用群资源"
    ],
    "action_items": [
      "供应商B打样评估",
      "声学团队散热孔位置确认"
    ],
    "risks_mentioned": [
      "供应商产能瓶颈",
      "备选方案精度不足",
      "模具T0节点可能延后"
    ],
    "provenance_refs": [
      {
        "source_type": "base_record",
        "source_file": "03_task_risk_register/base_projects_record_list.json",
        "source_id": "PJT-CASE-05",
        "timestamp": "2026-01-01",
        "excerpt": "2026年度智能家居产品线工业设计"
      },
      {
        "source_type": "base_record",
        "source_file": "04_meetings/base_meetings_record_list.json",
        "source_id": "MTG-CASE-05-03",
        "timestamp": "2026-04-24 09:00 - 09:45",
        "excerpt": "供应链风险应急沟通"
      },
      {
        "source_type": "statement",
        "source_file": "04_meetings/base_statements_record_list.json",
        "source_id": "MTG-CASE-05-03-STM-1",
        "timestamp": "MTG-CASE-05-03",
        "excerpt": "已经让法务在看了，初步判断有规避空间，但需要调整底部轮廓线。"
      },
      {
        "source_type": "statement",
        "source_file": "04_meetings/base_statements_record_list.json",
        "source_id": "MTG-CASE-05-03-STM-2",
        "timestamp": "MTG-CASE-05-03",
        "excerpt": "先不在群里说了，我单独找供应链总监协调，看看能不能插队。"
      },
      {
        "source_type": "chat",
        "source_file": "02_chats/im_messages_search_user.json",
        "source_id": "om_case05msg0002",
        "timestamp": "2026-04-01 09:15",
        "excerpt": "4月项目启动，本周重点是完成智能音箱和扫地机器人的概念设计评审。"
      },
      {
        "source_type": "chat",
        "source_file": "02_chats/im_messages_search_user.json",
        "source_id": "om_case05msg0003",
        "timestamp": "2026-04-01 09:20",
        "excerpt": "概念设计稿我已经发到云文档了，大家看一下有没有问题。"
      },
      {
        "source_type": "chat",
        "source_file": "02_chats/im_messages_search_user.json",
        "source_id": "om_case05msg0005",
        "timestamp": "2026-04-01 10:35",
        "excerpt": "收到，我调整一下底部轮廓线，增加差异化。"
      },
      {
        "source_type": "chat",
        "source_file": "02_chats/im_messages_search_user.json",
        "source_id": "om_case05msg0007",
        "timestamp": "2026-04-02 14:05",
        "excerpt": "我和声学团队确认一下，如果影响比较大就调整散热孔位置。"
      },
      {
        "source_type": "calendar",
        "source_file": "06_calendar/calendar_events_instance_view.json",
        "source_id": "cal_case05_evt_0424_emergency",
        "timestamp": "2026-04-24T09:00:00+08:00",
        "excerpt": "供应链风险应急沟通"
      }
    ]
  },
  "coordination_context": {
    "tasks": [
      {
        "id": "NO.501",
        "task_name": "智能音箱概念设计稿输出",
        "status": "已完成",
        "is_closed": "true",
        "project_id": "PJT-CASE-05",
        "close_duration": "3",
        "is_overdue": "false",
        "owner": "周牧",
        "due_date": "2026-04-05",
        "source_meeting_id": "MTG-CASE-05-01"
      },
      {
        "id": "NO.502",
        "task_name": "扫地机器人概念设计稿输出",
        "status": "已完成",
        "is_closed": "true",
        "project_id": "PJT-CASE-05",
        "close_duration": "3",
        "is_overdue": "false",
        "owner": "周牧",
        "due_date": "2026-04-05",
        "source_meeting_id": "MTG-CASE-05-01"
      },
      {
        "id": "NO.503",
        "task_name": "智能门锁概念设计稿输出",
        "status": "已完成",
        "is_closed": "true",
        "project_id": "PJT-CASE-05",
        "close_duration": "5",
        "is_overdue": "false",
        "owner": "周牧",
        "due_date": "2026-04-08",
        "source_meeting_id": "MTG-CASE-05-01"
      },
      {
        "id": "NO.504",
        "task_name": "概念设计评审会组织",
        "status": "已完成",
        "is_closed": "true",
        "project_id": "PJT-CASE-05",
        "close_duration": "2",
        "is_overdue": "false",
        "owner": "周牧",
        "due_date": "2026-04-10",
        "source_meeting_id": "MTG-CASE-05-01"
      },
      {
        "id": "NO.505",
        "task_name": "品牌颜色方案调整",
        "status": "已完成",
        "is_closed": "true",
        "project_id": "PJT-CASE-05",
        "close_duration": "4",
        "is_overdue": "false",
        "owner": "赵雪",
        "due_date": "2026-04-15",
        "source_meeting_id": "MTG-CASE-05-02"
      },
      {
        "id": "NO.506",
        "task_name": "供应商A报价评估",
        "status": "已完成",
        "is_closed": "true",
        "project_id": "PJT-CASE-05",
        "close_duration": "3",
        "is_overdue": "false",
        "owner": "林峰",
        "due_date": "2026-04-12",
        "source_meeting_id": "MTG-CASE-05-02"
      },
      {
        "id": "NO.507",
        "task_name": "散热孔与音质冲突协调",
        "status": "已完成",
        "is_closed": "true",
        "project_id": "PJT-CASE-05",
        "close_duration": "5",
        "is_overdue": "false",
        "owner": "周牧",
        "due_date": "2026-04-18",
        "source_meeting_id": "MTG-CASE-05-02"
      },
      {
        "id": "NO.508",
        "task_name": "供应商B打样评估",
        "status": "已完成",
        "is_closed": "true",
        "project_id": "PJT-CASE-05",
        "close_duration": "2",
        "is_overdue": "false",
        "owner": "林峰",
        "due_date": "2026-04-20",
        "source_meeting_id": "MTG-CASE-05-03"
      },
      {
        "id": "NO.509",
        "task_name": "智能音箱外观方案冻结",
        "status": "已完成",
        "is_closed": "true",
        "project_id": "PJT-CASE-05",
        "close_duration": "2",
        "is_overdue": "false",
        "owner": "周牧",
        "due_date": "2026-04-25",
        "source_meeting_id": "MTG-CASE-05-04"
      },
      {
        "id": "NO.510",
        "task_name": "扫地机器人外观方案冻结",
        "status": "已完成",
        "is_closed": "true",
        "project_id": "PJT-CASE-05",
        "close_duration": "2",
        "is_overdue": "false",
        "owner": "周牧",
        "due_date": "2026-04-25",
        "source_meeting_id": "MTG-CASE-05-04"
      },
      {
        "id": "NO.511",
        "task_name": "智能门锁防水等级调整",
        "status": "进行中",
        "is_closed": "false",
        "project_id": "PJT-CASE-05",
        "close_duration": "",
        "is_overdue": "false",
        "owner": "周牧",
        "due_date": "2026-05-05",
        "source_meeting_id": "MTG-CASE-05-04"
      },
      {
        "id": "NO.512",
        "task_name": "供应商A模具曲面返工",
        "status": "进行中",
        "is_closed": "false",
        "project_id": "PJT-CASE-05",
        "close_duration": "",
        "is_overdue": "false",
        "owner": "林峰",
        "due_date": "2026-04-28",
        "source_meeting_id": "MTG-CASE-05-05"
      },
      {
        "id": "NO.513",
        "task_name": "竞品专利规避方案",
        "status": "进行中",
        "is_closed": "false",
        "project_id": "PJT-CASE-05",
        "close_duration": "",
        "is_overdue": "false",
        "owner": "张悦",
        "due_date": "2026-05-10",
        "source_meeting_id": "MTG-CASE-05-06"
      },
      {
        "id": "NO.514",
        "task_name": "核心注塑供应商产能协调",
        "status": "进行中",
        "is_closed": "false",
        "project_id": "PJT-CASE-05",
        "close_duration": "",
        "is_overdue": "false",
        "owner": "林峰",
        "due_date": "2026-04-26",
        "source_meeting_id": "MTG-CASE-05-06"
      },
      {
        "id": "NO.515",
        "task_name": "CMF样品签样",
        "status": "待开始",
        "is_closed": "false",
        "project_id": "PJT-CASE-05",
        "close_duration": "",
        "is_overdue": "false",
        "owner": "赵雪",
        "due_date": "2026-06-15",
        "source_meeting_id": "MTG-CASE-05-05"
      },
      {
        "id": "NO.516",
        "task_name": "底部轮廓线专利规避调整",
        "status": "待开始",
        "is_closed": "false",
        "project_id": "PJT-CASE-05",
        "close_duration": "",
        "is_overdue": "false",
        "owner": "周牧",
        "due_date": "2026-05-08",
        "source_meeting_id": "MTG-CASE-05-06"
      },
      {
        "id": "NO.517",
        "task_name": "密封圈+导流槽方案验证",
        "status": "待开始",
        "is_closed": "false",
        "project_id": "PJT-CASE-05",
        "close_duration": "",
        "is_overdue": "false",
        "owner": "陈立",
        "due_date": "2026-05-15",
        "source_meeting_id": "MTG-CASE-05-04"
      },
      {
        "id": "NO.518",
        "task_name": "模具成本上升15%预算沟通",
        "status": "进行中",
        "is_closed": "false",
        "project_id": "PJT-CASE-05",
        "close_duration": "",
        "is_overdue": "false",
        "owner": "周牧",
        "due_date": "2026-04-30",